Capturing on 'Wi-Fi'
    1   0.000000 192.168.1.121 â†’ 216.58.209.3 TLSv1.2 154 Application Data
    2   0.021338 216.58.209.3 â†’ 192.168.1.121 TCP 60 443 â†’ 10796 [ACK] Seq=1 Ack=101 Win=252 Len=0
    3   0.060948 216.58.209.3 â†’ 192.168.1.121 TLSv1.2 128 [TCP Previous segment not captured] , Application Data
    4   0.060949 216.58.209.3 â†’ 192.168.1.121 TLSv1.2 85 Application Data
    5   0.060949 216.58.209.3 â†’ 192.168.1.121 TLSv1.2 93 Application Data
    6   0.061016 192.168.1.121 â†’ 216.58.209.3 TCP 66 [TCP Dup ACK 1#1] 10796 â†’ 443 [ACK] Seq=101 Ack=1 Win=257 Len=0 SLE=72 SRE=146
    7   0.061071 192.168.1.121 â†’ 216.58.209.3 TCP 66 [TCP Dup ACK 1#2] 10796 â†’ 443 [ACK] Seq=101 Ack=1 Win=257 Len=0 SLE=72 SRE=177
    8   0.061099 192.168.1.121 â†’ 216.58.209.3 TCP 66 [TCP Dup ACK 1#3] 10796 â†’ 443 [ACK] Seq=101 Ack=1 Win=257 Len=0 SLE=72 SRE=216
    9   0.087749 216.58.209.3 â†’ 192.168.1.121 TCP 125 [TCP Retransmission] 443 â†’ 10796 [PSH, ACK] Seq=1 Ack=101 Win=252 Len=71
   10   0.088467 192.168.1.121 â†’ 216.58.209.3 TLSv1.2 93 Application Data
   11   0.109142 216.58.209.3 â†’ 192.168.1.121 TCP 60 443 â†’ 10796 [ACK] Seq=216 Ack=140 Win=252 Len=0
   12   0.127116 192.168.1.121 â†’ 162.254.197.180 TLSv1.2 112 Application Data
   13   0.208716 162.254.197.180 â†’ 192.168.1.121 TCP 60 27021 â†’ 9935 [ACK] Seq=1 Ack=59 Win=1020 Len=0
   14   0.621651 192.168.1.121 â†’ 77.79.249.117 TLSv1.2 107 Application Data
   15   0.657209 77.79.249.117 â†’ 192.168.1.121 TCP 60 443 â†’ 9889 [ACK] Seq=1 Ack=54 Win=265 Len=0
   16   1.501830 192.168.1.121 â†’ 192.168.1.1  DNS 72 Standard query 0x8dac A auth.gog.com
   17   1.533302 192.168.1.121 â†’ 192.168.1.1  DNS 72 Standard query 0x8dac A auth.gog.com
   18   1.535480  192.168.1.1 â†’ 192.168.1.121 DNS 158 Standard query response 0x8dac A auth.gog.com CNAME gog.com.edgekey.net CNAME e11072.g.akamaiedge.net A 104.73.57.70
   19   1.536518  192.168.1.1 â†’ 192.168.1.121 DNS 158 Standard query response 0x8dac A auth.gog.com CNAME gog.com.edgekey.net CNAME e11072.g.akamaiedge.net A 104.73.57.70
   20   1.536881 192.168.1.121 â†’ 104.73.57.70 TCP 66 11494 â†’ 443 [SYN] Seq=0 Win=64240 Len=0 MSS=1460 WS=256 SACK_PERM=1
   21   1.585548 104.73.57.70 â†’ 192.168.1.121 TCP 66 443 â†’ 11494 [SYN, ACK] Seq=0 Ack=1 Win=29200 Len=0 MSS=1460 SACK_PERM=1 WS=128
   22   1.585650 192.168.1.121 â†’ 104.73.57.70 TCP 54 11494 â†’ 443 [ACK] Seq=1 Ack=1 Win=65536 Len=0
   23   1.585841 192.168.1.121 â†’ 104.73.57.70 TLSv1 571 Client Hello
   24   1.634082 104.73.57.70 â†’ 192.168.1.121 TCP 60 443 â†’ 11494 [ACK] Seq=1 Ack=518 Win=30336 Len=0
   25   1.636702 104.73.57.70 â†’ 192.168.1.121 TLSv1.2 1514 Server Hello
   26   1.638443 104.73.57.70 â†’ 192.168.1.121 TLSv1.2 1514 Certificate [TCP segment of a reassembled PDU]
   27   1.638443 104.73.57.70 â†’ 192.168.1.121 TLSv1.2 323 Server Key Exchange, Server Hello Done
   28   1.638506 192.168.1.121 â†’ 104.73.57.70 TCP 54 11494 â†’ 443 [ACK] Seq=518 Ack=3190 Win=65536 Len=0
   29   1.642481 192.168.1.121 â†’ 104.73.57.70 TLSv1.2 180 Client Key Exchange, Change Cipher Spec, Encrypted Handshake Message
   30   1.690574 104.73.57.70 â†’ 192.168.1.121 TLSv1.2 296 New Session Ticket, Change Cipher Spec, Encrypted Handshake Message
   31   1.691418 192.168.1.121 â†’ 104.73.57.70 TLSv1.2 711 Application Data
   32   1.780887 104.73.57.70 â†’ 192.168.1.121 TCP 60 443 â†’ 11494 [ACK] Seq=3432 Ack=1301 Win=31616 Len=0
   33   1.795683 104.73.57.70 â†’ 192.168.1.121 TLSv1.2 701 Application Data
   34   1.795944 192.168.1.121 â†’ 104.73.57.70 TLSv1.2 85 Encrypted Alert
   35   1.796030 192.168.1.121 â†’ 104.73.57.70 TCP 54 11494 â†’ 443 [FIN, ACK] Seq=1332 Ack=4079 Win=64768 Len=0
   36   1.844484 104.73.57.70 â†’ 192.168.1.121 TCP 54 443 â†’ 11494 [ACK] Seq=4079 Ack=1332 Win=31616 Len=0
   37   1.845229 104.73.57.70 â†’ 192.168.1.121 TLSv1.2 85 Encrypted Alert
   38   1.845230 104.73.57.70 â†’ 192.168.1.121 TCP 54 443 â†’ 11494 [FIN, ACK] Seq=4110 Ack=1333 Win=31616 Len=0
   39   1.845324 192.168.1.121 â†’ 104.73.57.70 TCP 54 11494 â†’ 443 [RST, ACK] Seq=1333 Ack=4110 Win=0 Len=0
   40   1.850732 192.168.1.121 â†’ 40.77.226.250 TLSv1.2 255 Application Data
   41   1.853601 192.168.1.121 â†’ 192.168.1.1  DNS 76 Standard query 0x8729 A presence.gog.com
   42   1.857281  192.168.1.1 â†’ 192.168.1.121 DNS 162 Standard query response 0x8729 A presence.gog.com CNAME gog.com.edgekey.net CNAME e11072.g.akamaiedge.net A 104.73.57.70
   43   1.858621 192.168.1.121 â†’ 104.73.57.70 TCP 66 11495 â†’ 443 [SYN] Seq=0 Win=64240 Len=0 MSS=1460 WS=256 SACK_PERM=1
   44   1.908421 104.73.57.70 â†’ 192.168.1.121 TCP 66 443 â†’ 11495 [SYN, ACK] Seq=0 Ack=1 Win=29200 Len=0 MSS=1460 SACK_PERM=1 WS=128
   45   1.908521 192.168.1.121 â†’ 104.73.57.70 TCP 54 11495 â†’ 443 [ACK] Seq=1 Ack=1 Win=65536 Len=0
   46   1.908651 192.168.1.121 â†’ 104.73.57.70 TLSv1 571 Client Hello
   47   1.922133 40.77.226.250 â†’ 192.168.1.121 TLSv1.2 108 Application Data
   48   1.922506 192.168.1.121 â†’ 40.77.226.250 TCP 1494 [TCP segment of a reassembled PDU]
   49   1.922507 192.168.1.121 â†’ 40.77.226.250 TCP 1494 11493 â†’ 443 [ACK] Seq=1642 Ack=55 Win=255 Len=1440 [TCP segment of a reassembled PDU]
   50   1.922507 192.168.1.121 â†’ 40.77.226.250 TCP 1494 11493 â†’ 443 [ACK] Seq=3082 Ack=55 Win=255 Len=1440 [TCP segment of a reassembled PDU]
   51   1.922510 192.168.1.121 â†’ 40.77.226.250 TCP 1494 11493 â†’ 443 [ACK] Seq=4522 Ack=55 Win=255 Len=1440 [TCP segment of a reassembled PDU]
   52   1.922510 192.168.1.121 â†’ 40.77.226.250 TCP 1494 11493 â†’ 443 [ACK] Seq=5962 Ack=55 Win=255 Len=1440 [TCP segment of a reassembled PDU]
   53   1.922511 192.168.1.121 â†’ 40.77.226.250 TCP 1494 11493 â†’ 443 [ACK] Seq=7402 Ack=55 Win=255 Len=1440 [TCP segment of a reassembled PDU]
   54   1.922511 192.168.1.121 â†’ 40.77.226.250 TCP 1494 11493 â†’ 443 [ACK] Seq=8842 Ack=55 Win=255 Len=1440 [TCP segment of a reassembled PDU]
   55   1.922511 192.168.1.121 â†’ 40.77.226.250 TLSv1.2 1049 Application Data
   56   1.956978 104.73.57.70 â†’ 192.168.1.121 TCP 60 443 â†’ 11495 [ACK] Seq=1 Ack=518 Win=30336 Len=0
   57   1.959805 104.73.57.70 â†’ 192.168.1.121 TLSv1.2 1514 Server Hello
   58   1.961620 104.73.57.70 â†’ 192.168.1.121 TLSv1.2 1514 Certificate [TCP segment of a reassembled PDU]
   59   1.961620 104.73.57.70 â†’ 192.168.1.121 TLSv1.2 323 Server Key Exchange, Server Hello Done
   60   1.961701 192.168.1.121 â†’ 104.73.57.70 TCP 54 11495 â†’ 443 [ACK] Seq=518 Ack=3190 Win=65536 Len=0
   61   1.964255 192.168.1.121 â†’ 104.73.57.70 TLSv1.2 180 Client Key Exchange, Change Cipher Spec, Encrypted Handshake Message
   62   1.994246 40.77.226.250 â†’ 192.168.1.121 TCP 60 443 â†’ 11493 [ACK] Seq=55 Ack=3082 Win=1026 Len=0
   63   1.994777 40.77.226.250 â†’ 192.168.1.121 TCP 60 443 â†’ 11493 [ACK] Seq=55 Ack=5962 Win=1026 Len=0
   64   1.995381 40.77.226.250 â†’ 192.168.1.121 TCP 60 443 â†’ 11493 [ACK] Seq=55 Ack=8842 Win=1026 Len=0
   65   1.995381 40.77.226.250 â†’ 192.168.1.121 TCP 60 443 â†’ 11493 [ACK] Seq=55 Ack=11277 Win=1026 Len=0
   66   2.007307 64.233.164.189 â†’ 192.168.1.121 TLSv1.2 107 Application Data
   67   2.014677 104.73.57.70 â†’ 192.168.1.121 TLSv1.2 296 New Session Ticket, Change Cipher Spec, Encrypted Handshake Message
   68   2.015501 192.168.1.121 â†’ 104.73.57.70 TLSv1.2 794 Application Data
   69   2.047882 192.168.1.121 â†’ 64.233.164.189 TCP 54 10798 â†’ 443 [ACK] Seq=1 Ack=54 Win=255 Len=0
   70   2.091593 40.77.226.250 â†’ 192.168.1.121 TLSv1.2 350 Application Data
   71   2.106951 104.73.57.70 â†’ 192.168.1.121 TCP 60 443 â†’ 11495 [ACK] Seq=3432 Ack=1384 Win=31872 Len=0
   72   2.107682 104.73.57.70 â†’ 192.168.1.121 TLSv1.2 285 Application Data
   73   2.107938 192.168.1.121 â†’ 104.73.57.70 TLSv1.2 85 Encrypted Alert
   74   2.108035 192.168.1.121 â†’ 104.73.57.70 TCP 54 11495 â†’ 443 [FIN, ACK] Seq=1415 Ack=3663 Win=65024 Len=0
   75   2.132098 192.168.1.121 â†’ 40.77.226.250 TCP 54 11493 â†’ 443 [ACK] Seq=11277 Ack=351 Win=254 Len=0
   76   2.157041 104.73.57.70 â†’ 192.168.1.121 TCP 54 443 â†’ 11495 [ACK] Seq=3663 Ack=1415 Win=31872 Len=0
   77   2.158315 104.73.57.70 â†’ 192.168.1.121 TLSv1.2 85 Encrypted Alert
   78   2.158399 192.168.1.121 â†’ 104.73.57.70 TCP 54 11495 â†’ 443 [RST, ACK] Seq=1416 Ack=3694 Win=0 Len=0
   79   2.158964 104.73.57.70 â†’ 192.168.1.121 TCP 54 443 â†’ 11495 [FIN, ACK] Seq=3694 Ack=1416 Win=31872 Len=0
   80   2.253863 149.154.167.51 â†’ 192.168.1.121 SSL 159 Continuation Data
   81   2.293658 192.168.1.121 â†’ 149.154.167.51 TCP 54 9856 â†’ 443 [ACK] Seq=1 Ack=106 Win=251 Len=0
   82   2.332356 149.154.167.51 â†’ 192.168.1.121 SSL 159 Continuation Data
   83   2.372582 192.168.1.121 â†’ 149.154.167.51 TCP 54 9856 â†’ 443 [ACK] Seq=1 Ack=211 Win=256 Len=0
   84   3.332657 192.168.1.121 â†’ 104.96.148.23 TCP 55 [TCP segment of a reassembled PDU]
   85   3.371097 104.96.148.23 â†’ 192.168.1.121 TCP 66 443 â†’ 11485 [ACK] Seq=1 Ack=2 Win=278 Len=0 SLE=1 SRE=2
   86   3.479043 AsustekC_49:f8:2c â†’ IntelCor_20:00:e9 ARP 42 Who has 192.168.1.121? Tell 192.168.1.1
   87   3.479072 IntelCor_20:00:e9 â†’ AsustekC_49:f8:2c ARP 42 192.168.1.121 is at 3c:f8:62:20:00:e9
   88   4.243121 192.168.1.121 â†’ 149.154.167.51 SSL 223 Continuation Data
   89   4.288524 149.154.167.51 â†’ 192.168.1.121 TCP 60 443 â†’ 9856 [ACK] Seq=211 Ack=170 Win=32768 Len=0
   90   4.289110 149.154.167.51 â†’ 192.168.1.121 SSL 143 Continuation Data
   91   4.329281 192.168.1.121 â†’ 149.154.167.51 TCP 54 9856 â†’ 443 [ACK] Seq=170 Ack=300 Win=256 Len=0
   92   4.685671 149.154.167.51 â†’ 192.168.1.121 SSL 159 Continuation Data
   93   4.686329 192.168.1.121 â†’ 149.154.167.51 SSL 143 Continuation Data
   94   4.773425 149.154.167.51 â†’ 192.168.1.121 TCP 60 443 â†’ 9856 [ACK] Seq=405 Ack=259 Win=32768 Len=0
   95   5.620569 192.168.1.121 â†’ 184.30.210.217 TLSv1.2 85 Encrypted Alert
   96   5.621867 192.168.1.121 â†’ 192.168.1.1  DNS 78 Standard query 0x68bd A steamcommunity.com
   97   5.653377 192.168.1.121 â†’ 192.168.1.1  DNS 78 Standard query 0x68bd A steamcommunity.com
   98   5.659144 184.30.210.217 â†’ 192.168.1.121 TCP 60 443 â†’ 11467 [ACK] Seq=1 Ack=32 Win=258 Len=0
   99   5.660145 184.30.210.217 â†’ 192.168.1.121 TLSv1.2 85 Encrypted Alert
  100   5.660145 184.30.210.217 â†’ 192.168.1.121 TCP 54 443 â†’ 11467 [FIN, ACK] Seq=32 Ack=32 Win=258 Len=0
  101   5.660238 192.168.1.121 â†’ 184.30.210.217 TCP 54 11467 â†’ 443 [ACK] Seq=32 Ack=33 Win=256 Len=0
  102   5.660609 192.168.1.121 â†’ 184.30.210.217 TCP 54 11467 â†’ 443 [FIN, ACK] Seq=32 Ack=33 Win=256 Len=0
  103   5.661048  192.168.1.1 â†’ 192.168.1.121 DNS 94 Standard query response 0x68bd A steamcommunity.com A 184.30.210.217
  104   5.662454 192.168.1.121 â†’ 184.30.210.217 TCP 66 11496 â†’ 443 [SYN] Seq=0 Win=64240 Len=0 MSS=1460 WS=256 SACK_PERM=1
  105   5.701389 184.30.210.217 â†’ 192.168.1.121 TCP 54 443 â†’ 11467 [ACK] Seq=33 Ack=33 Win=258 Len=0
  106   5.703591 184.30.210.217 â†’ 192.168.1.121 TCP 66 443 â†’ 11496 [SYN, ACK] Seq=0 Ack=1 Win=29200 Len=0 MSS=1460 SACK_PERM=1 WS=128
  107   5.703752 192.168.1.121 â†’ 184.30.210.217 TCP 54 11496 â†’ 443 [ACK] Seq=1 Ack=1 Win=65536 Len=0
  108   5.704387 192.168.1.121 â†’ 184.30.210.217 TLSv1 257 Client Hello
  109   5.743113 184.30.210.217 â†’ 192.168.1.121 TCP 60 443 â†’ 11496 [ACK] Seq=1 Ack=204 Win=30336 Len=0
  110   5.745860 184.30.210.217 â†’ 192.168.1.121 TLSv1.2 1514 Server Hello
  111   5.748032 184.30.210.217 â†’ 192.168.1.121 TCP 1514 443 â†’ 11496 [ACK] Seq=1461 Ack=204 Win=30336 Len=1460 [TCP segment of a reassembled PDU]
  112   5.748033 184.30.210.217 â†’ 192.168.1.121 TLSv1.2 861 Certificate, Server Key Exchange, Server Hello Done
  113   5.748142 192.168.1.121 â†’ 184.30.210.217 TCP 54 11496 â†’ 443 [ACK] Seq=204 Ack=3728 Win=65536 Len=0
  114   5.754033 192.168.1.121 â†’ 184.30.210.217 TLSv1.2 180 Client Key Exchange, Change Cipher Spec, Encrypted Handshake Message
  115   5.797888 184.30.210.217 â†’ 192.168.1.121 TLSv1.2 312 New Session Ticket, Change Cipher Spec, Encrypted Handshake Message
  116   5.798948 192.168.1.121 â†’ 184.30.210.217 TLSv1.2 736 Application Data
  117   5.862511 192.168.1.121 â†’ 162.254.197.42 TLSv1.2 112 Application Data
  118   5.878348 184.30.210.217 â152 packets captured
†’ 192.168.1.121 TCP 60 443 â†’ 11496 [ACK] Seq=3986 Ack=1012 Win=31744 Len=0
  119   5.950537 162.254.197.42 â†’ 192.168.1.121 TCP 60 27021 â†’ 9942 [ACK] Seq=1 Ack=59 Win=251 Len=0
  120   6.120451 184.30.210.217 â†’ 192.168.1.121 TCP 1514 [TCP segment of a reassembled PDU]
  121   6.121237 184.30.210.217 â†’ 192.168.1.121 TLSv1.2 97 Application Data
  122   6.121335 192.168.1.121 â†’ 184.30.210.217 TCP 54 11496 â†’ 443 [ACK] Seq=1012 Ack=5489 Win=65536 Len=0
  123   6.123358 192.168.1.121 â†’ 184.30.210.217 TLSv1.2 728 Application Data
  124   6.161767 184.30.210.217 â†’ 192.168.1.121 TCP 60 443 â†’ 11496 [ACK] Seq=5489 Ack=1686 Win=33024 Len=0
  125   6.730723 184.30.210.217 â†’ 192.168.1.121 TCP 1514 [TCP segment of a reassembled PDU]
  126   6.732468 184.30.210.217 â†’ 192.168.1.121 TLSv1.2 622 Application Data
  127   6.732468 184.30.210.217 â†’ 192.168.1.121 TLSv1.2 1311 Application Data
  128   6.732563 192.168.1.121 â†’ 184.30.210.217 TCP 54 11496 â†’ 443 [ACK] Seq=1686 Ack=8774 Win=65536 Len=0
  129   7.048380 192.168.1.121 â†’ 192.168.1.1  DNS 92 Standard query 0xe511 A external-accounts-galaxy.gog.com
  130   7.079294 192.168.1.121 â†’ 192.168.1.1  DNS 92 Standard query 0xe511 A external-accounts-galaxy.gog.com
  131   7.136416  192.168.1.1 â†’ 192.168.1.121 DNS 203 Standard query response 0xe511 A external-accounts-galaxy.gog.com CNAME external-accounts-galaxy.gog.com.edgekey.net CNAME e11072.f.akamaiedge.net A 104.73.57.70
  132   7.137875 192.168.1.121 â†’ 104.73.57.70 TCP 66 11497 â†’ 443 [SYN] Seq=0 Win=64240 Len=0 MSS=1460 WS=256 SACK_PERM=1
  133   7.193181 104.73.57.70 â†’ 192.168.1.121 TCP 66 443 â†’ 11497 [SYN, ACK] Seq=0 Ack=1 Win=29200 Len=0 MSS=1460 SACK_PERM=1 WS=128
  134   7.193302 192.168.1.121 â†’ 104.73.57.70 TCP 54 11497 â†’ 443 [ACK] Seq=1 Ack=1 Win=65536 Len=0
  135   7.193490 192.168.1.121 â†’ 104.73.57.70 TLSv1 571 Client Hello
  136   7.248459 104.73.57.70 â†’ 192.168.1.121 TCP 60 443 â†’ 11497 [ACK] Seq=1 Ack=518 Win=30336 Len=0
  137   7.251625 104.73.57.70 â†’ 192.168.1.121 TLSv1.2 1514 Server Hello
  138   7.253307 104.73.57.70 â†’ 192.168.1.121 TLSv1.2 1514 Certificate [TCP segment of a reassembled PDU]
  139   7.253308 104.73.57.70 â†’ 192.168.1.121 TLSv1.2 323 Server Key Exchange, Server Hello Done
  140   7.253399 192.168.1.121 â†’ 104.73.57.70 TCP 54 11497 â†’ 443 [ACK] Seq=518 Ack=3190 Win=65536 Len=0
  141   7.256747 192.168.1.121 â†’ 104.73.57.70 TLSv1.2 180 Client Key Exchange, Change Cipher Spec, Encrypted Handshake Message
  142   7.311244 104.73.57.70 â†’ 192.168.1.121 TLSv1.2 312 New Session Ticket, Change Cipher Spec, Encrypted Handshake Message
  143   7.312219 192.168.1.121 â†’ 104.73.57.70 TLSv1.2 985 Application Data
  144   7.409361 104.73.57.70 â†’ 192.168.1.121 TCP 60 443 â†’ 11497 [ACK] Seq=3448 Ack=1575 Win=32256 Len=0
  145   7.410122 104.73.57.70 â†’ 192.168.1.121 TLSv1.2 310 Application Data
  146   7.410327 192.168.1.121 â†’ 104.73.57.70 TLSv1.2 85 Encrypted Alert
  147   7.410436 192.168.1.121 â†’ 104.73.57.70 TCP 54 11497 â†’ 443 [FIN, ACK] Seq=1606 Ack=3704 Win=65024 Len=0
  148   7.464125 104.73.57.70 â†’ 192.168.1.121 TCP 54 443 â†’ 11497 [ACK] Seq=3704 Ack=1606 Win=32256 Len=0
  149   7.465027 104.73.57.70 â†’ 192.168.1.121 TLSv1.2 85 Encrypted Alert
  150   7.465027 104.73.57.70 â†’ 192.168.1.121 TCP 54 443 â†’ 11497 [FIN, ACK] Seq=3735 Ack=1606 Win=32256 Len=0
  151   7.465147 192.168.1.121 â†’ 104.73.57.70 TCP 54 11497 â†’ 443 [RST, ACK] Seq=1607 Ack=3735 Win=0 Len=0
  152   7.465262 104.73.57.70 â†’ 192.168.1.121 TCP 54 443 â†’ 11497 [ACK] Seq=3736 Ack=1607 Win=32256 Len=0
